<!ELEMENT scenario ( CallLengthRepartition | ResponseTimeRepartition | Reference | send | recv | pause | nop | sendCmd | recvCmd | label | timewait)* >
<!ATTLIST scenario name CDATA #IMPLIED >

<!-- BEGIN message commands -->

<!ENTITY % messageCmdCommon '
  start_rtd NMTOKEN #IMPLIED
  rtd NMTOKEN #IMPLIED
  repeat_rtd (true|false) #IMPLIED
  crlf (true|false) #IMPLIED
  next NMTOKEN #IMPLIED
  test NMTOKEN #IMPLIED
  chance NMTOKEN #IMPLIED
  condexec NMTOKEN #IMPLIED
  condexec_inverse NMTOKEN #IMPLIED
  counter NMTOKEN #IMPLIED
  '>

<!ELEMENT send (#PCDATA|action)* >
<!ATTLIST send %messageCmdCommon; >
<!ATTLIST send retrans NMTOKEN #IMPLIED >
<!ATTLIST send lost NMTOKEN #IMPLIED >
<!ATTLIST send start_txn NMTOKEN #IMPLIED >
<!ATTLIST send ack_txn NMTOKEN #IMPLIED >

<!ELEMENT recv ( action? ) >
<!ATTLIST recv %messageCmdCommon; >
<!ATTLIST recv response CDATA #IMPLIED >
<!ATTLIST recv request CDATA #IMPLIED >
<!ATTLIST recv optional (true|false) #IMPLIED >
<!ATTLIST recv ignosesdp (true|false) #IMPLIED >
<!ATTLIST recv rrs (true|false) #IMPLIED >
<!ATTLIST recv auth (true|false) #IMPLIED >
<!ATTLIST recv lost NMTOKEN #IMPLIED >
<!ATTLIST recv timeout NMTOKEN #IMPLIED >
<!ATTLIST recv ontimeout NMTOKEN #IMPLIED >
<!ATTLIST recv regexp_match (true|false) #IMPLIED >
<!ATTLIST recv response_txn NMTOKEN #IMPLIED >

<!ELEMENT pause EMPTY >
<!ATTLIST pause %messageCmdCommon; >
<!ATTLIST pause milliseconds NMTOKEN #IMPLIED >
<!ATTLIST pause variable NMTOKEN #IMPLIED >
<!ATTLIST pause distribution NMTOKEN #IMPLIED >
<!ATTLIST pause sanity_check (true|false) #IMPLIED >

<!ELEMENT nop ( action? ) >
<!ATTLIST nop %messageCmdCommon; >
<!ATTLIST nop display CDATA #IMPLIED >

<!ELEMENT sendCmd ( #PCDATA ) >
<!ATTLIST sendCmd %messageCmdCommon; >
<!ATTLIST sendCmd dest NMTOKEN #IMPLIED >

<!ELEMENT recvCmd ( action? ) >
<!ATTLIST recvCmd %messageCmdCommon; >
<!ATTLIST recvCmd src NMTOKEN #IMPLIED >

<!-- END message commands -->

<!ELEMENT label ( #PCDATA ) >
<!ATTLIST label id NMTOKEN #IMPLIED >

<!ELEMENT ResponseTimeRepartition EMPTY >
<!ATTLIST ResponseTimeRepartition value CDATA #REQUIRED >

<!ELEMENT CallLengthRepartition EMPTY >
<!ATTLIST CallLengthRepartition value CDATA #REQUIRED >

<!ELEMENT action ( add | assign | assignstr | closecon | divide | ereg | error | exec | gettimeofday | index | insert | jump | log | lookup | multiply | pauserestore | replace | rtp_echo | sample | setdest | strcmp | subtract | test | todouble | trim | urldecode | urlencode | verifyauth | warning )+ >

<!-- BEGIN actions -->

<!-- the right-hand side of an arithmetic action: one of value or variable -->
<!ENTITY % rhs '
  value CDATA #IMPLIED
  variable CDATA #IMPLIED
  '>

<!-- string and numeric comparisons: assign_to may be left out when
     check_it or check_it_inverse is set; one of value or variable2 -->
<!ENTITY % comparison '
  assign_to CDATA #IMPLIED
  variable CDATA #REQUIRED
  value CDATA #IMPLIED
  variable2 CDATA #IMPLIED
  check_it (true|false) #IMPLIED
  check_it_inverse (true|false) #IMPLIED
  '>

<!ELEMENT ereg EMPTY >
<!ATTLIST ereg assign_to CDATA #REQUIRED >
<!ATTLIST ereg check_it (true|false) "false" >
<!ATTLIST ereg check_it_inverse (true|false) #IMPLIED >
<!ATTLIST ereg case_indep (true|false) #IMPLIED >
<!ATTLIST ereg header CDATA #IMPLIED >
<!ATTLIST ereg occurrence CDATA #IMPLIED >
<!-- old misspelling of occurrence -->
<!ATTLIST ereg occurence CDATA #IMPLIED >
<!ATTLIST ereg regexp CDATA #REQUIRED >
<!ATTLIST ereg search_in (msg|body|hdr|var) "msg" >
<!ATTLIST ereg start_line (true|false) #IMPLIED >
<!-- the variable to search when search_in="var" -->
<!ATTLIST ereg variable CDATA #IMPLIED >

<!ELEMENT log EMPTY >
<!ATTLIST log message CDATA #REQUIRED >

<!ELEMENT warning EMPTY >
<!ATTLIST warning message CDATA #REQUIRED >

<!ELEMENT error EMPTY >
<!ATTLIST error message CDATA #REQUIRED >

<!ELEMENT exec EMPTY >
<!-- exactly one of these must be present -->
<!ATTLIST exec command CDATA #IMPLIED >
<!ATTLIST exec int_cmd (stop_now|stop_gracefully|stop_call) "stop_call" >
<!ATTLIST exec play_pcap_audio CDATA #IMPLIED >
<!ATTLIST exec play_pcap_image CDATA #IMPLIED >
<!ATTLIST exec play_pcap_video CDATA #IMPLIED >
<!ATTLIST exec play_dtmf CDATA #IMPLIED >
<!ATTLIST exec rtp_stream CDATA #IMPLIED >
<!ATTLIST exec rtp_echo CDATA #IMPLIED >

<!ELEMENT rtp_echo EMPTY >
<!ATTLIST rtp_echo %rhs; >

<!ELEMENT strcmp EMPTY >
<!ATTLIST strcmp %comparison; >

<!ELEMENT test EMPTY >
<!ATTLIST test %comparison; >
<!ATTLIST test compare (equal|not_equal|greater_than|less_than|greater_than_equal|less_than_equal) #REQUIRED >

<!ELEMENT assign EMPTY >
<!ATTLIST assign assign_to CDATA #REQUIRED %rhs; >

<!ELEMENT add EMPTY >
<!ATTLIST add assign_to CDATA #REQUIRED %rhs; >

<!ELEMENT subtract EMPTY >
<!ATTLIST subtract assign_to CDATA #REQUIRED %rhs; >

<!ELEMENT multiply EMPTY >
<!ATTLIST multiply assign_to CDATA #REQUIRED %rhs; >

<!ELEMENT divide EMPTY >
<!ATTLIST divide assign_to CDATA #REQUIRED %rhs; >

<!ELEMENT jump EMPTY >
<!ATTLIST jump %rhs; >

<!ELEMENT pauserestore EMPTY >
<!ATTLIST pauserestore %rhs; >

<!ELEMENT assignstr EMPTY >
<!ATTLIST assignstr assign_to CDATA #REQUIRED >
<!ATTLIST assignstr value CDATA #REQUIRED >

<!ELEMENT todouble EMPTY >
<!ATTLIST todouble assign_to CDATA #REQUIRED >
<!ATTLIST todouble variable CDATA #REQUIRED >

<!ELEMENT sample EMPTY >
<!ATTLIST sample assign_to CDATA #REQUIRED >
<!ATTLIST sample distribution (fixed|uniform|normal|lognormal|exponential|weibull|pareto|gpareto|gamma|negbin) #REQUIRED >
<!-- the parameters of the chosen distribution -->
<!ATTLIST sample value CDATA #IMPLIED >
<!ATTLIST sample min CDATA #IMPLIED >
<!ATTLIST sample max CDATA #IMPLIED >
<!ATTLIST sample mean CDATA #IMPLIED >
<!ATTLIST sample stdev CDATA #IMPLIED >
<!ATTLIST sample lambda CDATA #IMPLIED >
<!ATTLIST sample k CDATA #IMPLIED >
<!ATTLIST sample x_m CDATA #IMPLIED >
<!ATTLIST sample shape CDATA #IMPLIED >
<!ATTLIST sample scale CDATA #IMPLIED >
<!ATTLIST sample location CDATA #IMPLIED >
<!ATTLIST sample theta CDATA #IMPLIED >
<!ATTLIST sample n CDATA #IMPLIED >
<!ATTLIST sample p CDATA #IMPLIED >

<!ELEMENT gettimeofday EMPTY >
<!-- two comma-separated variables: seconds,microseconds -->
<!ATTLIST gettimeofday assign_to CDATA #REQUIRED >

<!ELEMENT index EMPTY >
<!ATTLIST index assign_to CDATA #REQUIRED >

<!ELEMENT trim EMPTY >
<!ATTLIST trim assign_to CDATA #REQUIRED >

<!ELEMENT urldecode EMPTY >
<!ATTLIST urldecode variable CDATA #REQUIRED >

<!ELEMENT urlencode EMPTY >
<!ATTLIST urlencode variable CDATA #REQUIRED >

<!ELEMENT verifyauth EMPTY >
<!ATTLIST verifyauth assign_to CDATA #REQUIRED >
<!ATTLIST verifyauth username CDATA #REQUIRED >
<!ATTLIST verifyauth password CDATA #REQUIRED >

<!ELEMENT lookup EMPTY >
<!ATTLIST lookup assign_to CDATA #REQUIRED >
<!ATTLIST lookup file CDATA #REQUIRED >
<!ATTLIST lookup key CDATA #REQUIRED >

<!ELEMENT insert EMPTY >
<!ATTLIST insert file CDATA #REQUIRED >
<!ATTLIST insert value CDATA #REQUIRED >

<!ELEMENT replace EMPTY >
<!ATTLIST replace file CDATA #REQUIRED >
<!ATTLIST replace line CDATA #REQUIRED >
<!ATTLIST replace value CDATA #REQUIRED >

<!ELEMENT setdest EMPTY >
<!ATTLIST setdest host CDATA #REQUIRED >
<!ATTLIST setdest port CDATA #REQUIRED >
<!ATTLIST setdest protocol CDATA #REQUIRED >

<!ELEMENT closecon EMPTY >

<!-- END actions -->

<!ELEMENT timewait EMPTY >
<!ATTLIST timewait milliseconds CDATA #REQUIRED >

<!ELEMENT Reference EMPTY >
<!ATTLIST Reference variables CDATA #REQUIRED >
