<?xml version="1.0" encoding="ISO-8859-1" ?>
<!DOCTYPE scenario SYSTEM "sipp.dtd">

<!-- Answers AES_CM_128_HMAC_SHA1_80, and echoes the SRTP. -->
<scenario name="answer SRTP">
  <recv request="INVITE" />

  <send retrans="500">
    <![CDATA[

      SIP/2.0 200 OK
      [last_Via:]
      [last_From:]
      [last_To:];tag=[call_number]
      [last_Call-ID:]
      [last_CSeq:]
      Contact: <sip:uas@[local_ip]:[local_port]>
      Content-Type: application/sdp
      Content-Length: [len]

      v=0
      o=uas 0 0 IN IP[media_ip_type] [media_ip]
      s=-
      c=IN IP[media_ip_type] [media_ip]
      t=0 0
      m=audio [rtpstream_audio_port] RTP/SAVP 0
      a=crypto:[cryptotag1audio] [cryptosuiteaescm128sha1801audio] inline:[cryptokeyparams1audio]
      a=rtpmap:0 PCMU/8000

    ]]>
  </send>

  <recv request="ACK" />

  <nop>
    <action>
      <exec rtp_echo="startaudio,0,PCMU/8000" />
    </action>
  </nop>

  <recv request="BYE" />

  <send>
    <![CDATA[

      SIP/2.0 200 OK
      [last_Via:]
      [last_From:]
      [last_To:]
      [last_Call-ID:]
      [last_CSeq:]
      Content-Length: 0

    ]]>
  </send>

  <nop>
    <action>
      <exec rtp_echo="stopaudio,0,PCMU/8000" />
    </action>
  </nop>
</scenario>
