<?xml version="1.0" encoding="ISO-8859-1" ?>
<!DOCTYPE scenario SYSTEM "sipp.dtd">

<scenario name="Basic MCD UAS">
  <recv request="INVITE" crlf="true">
    <action>
      <!-- Save the INVITE's CSeq header for later reuse -->
      <ereg regexp=".*" search_in="hdr" header="CSeq:" check_it="true" assign_to="1" />
      <!-- Save the INVITE's Via header for later reuse -->
      <ereg regexp=".*" search_in="hdr" header="Via:" check_it="true" assign_to="2" />
    </action>
  </recv>

  <!-- NOTE:  The INVITE's Via/CSeq headers are used explicitly here -->
  <send>
    <![CDATA[

      SIP/2.0 180 Ringing
      [last_Via:]
      [last_From:]
      [last_To:];tag=[call_number]
      [last_Call-ID:]
      [last_CSeq:]
      Require: 100rel
      RSeq: 1
      Server: VIRTUAL Mitel-3300-ICP 12.0.1.99
      Contact: <sip:[local_ip]:[local_port];transport=[transport]>
      Content-Length: 0

    ]]>
  </send>

  <recv request="PRACK">
  </recv>

  <send>
    <![CDATA[

      SIP/2.0 200 OK
      [last_Via:]
      [last_From:]
      [last_To:]
      [last_Call-ID:]
      [last_CSeq:]
      Contact: <sip:[local_ip]:[local_port];transport=[transport]>
      Server: VIRTUAL Mitel-3300-ICP-12.0.1.99
      Content-Length: 0

    ]]>
  </send>

  <!-- NOTE:  The INVITE's Via/CSeq headers are used explicitly here -->
  <send retrans="500">
    <![CDATA[

      SIP/2.0 200 OK
      Via: [$2]
      [last_From:]
      [last_To:]
      [last_Call-ID:]
      CSeq: [$1]
      Contact: <sip:[local_ip]:[local_port];transport=[transport]>
      Server: VIRTUAL Mitel-3300-ICP 12.0.1.99
      Content-Type: application/sdp
      Content-Length: [len]

      v=0
      o=16002 0 0 IN IP[media_ip_type] [media_ip]
      s=-
      c=IN IP[media_ip_type] [media_ip]
      t=0 0
      m=audio [media_port] RTP/AVP 9 0 18 103 8 101
      a=rtcp:[media_port+1]
      a=sendrecv
      a=rtpmap:9 G722/8000
      a=fmtp:9 bitrate=64000
      a=rtpmap:0 PCMU/8000
      a=rtpmap:18 G729/8000
      a=rtpmap:103 G7221/16000
      a=fmtp:103 bitrate=32000
      a=rtpmap:8 PCMA/8000
      a=rtpmap:101 telephone-event/8000
      a=fmtp:101 0-11,16

    ]]>
  </send>

  <recv request="ACK">
  </recv>

  <recv request="BYE">
  </recv>

  <send>
    <![CDATA[
      SIP/2.0 200 OK
      [last_Via:]
      [last_From:]
      [last_To:]
      [last_Call-ID:]
      [last_CSeq:]
      Server: VIRTUAL Mitel-3300-ICP 12.0.1.99
      Content-Length: 0
    ]]>
  </send>

  <!-- definition of the response time repartition table (unit is ms)   -->
  <ResponseTimeRepartition value="10, 20, 30, 40, 50, 100, 150, 200"/>

  <!-- definition of the call length repartition table (unit is ms)     -->
  <CallLengthRepartition value="10, 50, 100, 500, 1000, 5000, 10000"/>

</scenario>
