<?xml version="1.0" encoding="UTF-8" ?>
<!DOCTYPE scenario SYSTEM "sipp.dtd">
<scenario name="rtp_stream plays that start at once">

  <send retrans="500">
    <![CDATA[

      INVITE sip:[service]@[remote_ip]:[remote_port] SIP/2.0
      Via: SIP/2.0/[transport] [local_ip]:[local_port];branch=[branch]
      From: sipp <sip:sipp@[local_ip]:[local_port]>;tag=[call_number]
      To: <sip:[service]@[remote_ip]:[remote_port]>
      Call-ID: [call_id]
      CSeq: 1 INVITE
      Contact: sip:sipp@[local_ip]:[local_port]
      Content-Type: application/sdp
      Content-Length: [len]

      v=0
      o=user1 53655765 2353687637 IN IP[local_ip_type] [local_ip]
      s=-
      c=IN IP[media_ip_type] [media_ip]
      t=0 0
      m=audio [rtpstream_audio_port] RTP/AVP 0
      a=rtpmap:0 PCMU/8000

    ]]>
  </send>

  <recv response="100" optional="true" />

  <recv response="180" optional="true" />

  <recv response="200" />

  <send>
    <![CDATA[

      ACK sip:[service]@[remote_ip]:[remote_port] SIP/2.0
      Via: SIP/2.0/[transport] [local_ip]:[local_port];branch=[branch]
      From: sipp <sip:sipp@[local_ip]:[local_port]>;tag=[call_number]
      To: <sip:[service]@[remote_ip]:[remote_port]>[peer_tag_param]
      Call-ID: [call_id]
      CSeq: 1 ACK
      Content-Length: 0

    ]]>
  </send>

  <!-- Plays of one packet, each over about a packet time after it
       starts: 8 of them take well under 8 idle wake-ups of the playback
       thread, which could each be up to 100 ms away. -->
  <label id="play" />

  <nop>
    <action>
      <gettimeofday assign_to="s1,us1" />
      <exec rtp_stream="packet.ulaw,1,0,PCMU/8000" />
      <exec rtp_stream="wait" timeout="2000" />
    </action>
  </nop>

  <nop next="play" test="more">
    <action>
      <gettimeofday assign_to="s2,us2" />
      <subtract assign_to="s2" variable="s1" />
      <multiply assign_to="s2" value="1000000" />
      <add assign_to="s2" variable="us2" />
      <subtract assign_to="s2" variable="us1" />
      <add assign_to="total" variable="s2" />
      <add assign_to="plays" value="1" />
      <test assign_to="more" variable="plays" compare="less_than" value="8" />
    </action>
  </nop>

  <nop>
    <action>
      <test variable="total" compare="less_than" value="270000" check_it="true" />
    </action>
  </nop>

  <send retrans="500">
    <![CDATA[

      BYE sip:[service]@[remote_ip]:[remote_port] SIP/2.0
      Via: SIP/2.0/[transport] [local_ip]:[local_port];branch=[branch]
      From: sipp <sip:sipp@[local_ip]:[local_port]>;tag=[call_number]
      To: <sip:[service]@[remote_ip]:[remote_port]>[peer_tag_param]
      Call-ID: [call_id]
      CSeq: 2 BYE
      Content-Length: 0

    ]]>
  </send>

  <recv response="200" crlf="true" />
</scenario>
