<?xml version="1.0" encoding="ISO-8859-1" ?>
<!DOCTYPE scenario SYSTEM "sipp.dtd">
<!-- The 200 goes out twice: with the same To-tag as a retransmission
     (-key tag2 01), or with another one as through a forking proxy
     (-key tag2 02). -->
<scenario name="200 sent twice">
  <recv request="INVITE"/>
  <send>
    <![CDATA[
      SIP/2.0 200 OK
      [last_Via:]
      [last_From:]
      [last_To:];tag=[pid]SIPpTag01[call_number]
      [last_Call-ID:]
      [last_CSeq:]
      Contact: <sip:[local_ip]:[local_port];transport=[transport]>
      Content-Length: 0
    ]]>
  </send>
  <pause milliseconds="300"/>
  <send>
    <![CDATA[
      SIP/2.0 200 OK
      [last_Via:]
      [last_From:]
      [last_To:];tag=[pid]SIPpTag[tag2][call_number]
      [last_Call-ID:]
      [last_CSeq:]
      Contact: <sip:[local_ip]:[local_port];transport=[transport]>
      Content-Length: 0
    ]]>
  </send>
  <recv request="ACK"/>
  <recv request="BYE"/>
  <send>
    <![CDATA[
      SIP/2.0 200 OK
      [last_Via:]
      [last_From:]
      [last_To:]
      [last_Call-ID:]
      [last_CSeq:]
      Content-Length: 0
    ]]>
  </send>
</scenario>
