<?xml version="1.0" encoding="UTF-8" ?>
<!DOCTYPE scenario SYSTEM "sipp.dtd">
<scenario name="oinv-i200-ibye.xml -- wjd 2014">

  <send retrans="500" start_txn="invite">
    <![CDATA[

      INVITE sip:[service]@[remote_ip]:[remote_port] SIP/2.0
      Via: SIP/2.0/[transport] [local_ip]:[local_port];branch=[branch]
      From: sip:[service]@[local_ip]:[local_port];tag=[pid]SIPpTag00[call_number]
      To: sip:[service]@[remote_ip]:[remote_port]
      Call-ID: [call_id]
      CSeq: [cseq] INVITE
      Contact: sip:[service]@[local_ip]:[local_port]
      Content-Type: application/sdp
      Content-Length: [len]

      v=0
      o=user1 53655765 2353687637 IN IP[local_ip_type] [local_ip]
      s=-
      c=IN IP[media_ip_type] [media_ip]
      t=0 0
      m=audio [media_port] RTP/AVP 8 0
      a=rtpmap:8 PCMA/8000
      a=rtpmap:0 PCMU/8000

    ]]>
  </send>

  <recv response="100" optional="true" response_txn="invite"/>

  <recv response="180" optional="true" response_txn="invite"/>

  <recv response="183" optional="true" response_txn="invite"/>

  <recv response="200" rrs="true" response_txn="invite"/>

  <send ack_txn="invite">
    <![CDATA[

      ACK [next_url] SIP/2.0
      Via: SIP/2.0/[transport] [local_ip]:[local_port];branch=[branch]
      [routes]
      From: sip:[service]@[local_ip]:[local_port];tag=[pid]SIPpTag00[call_number]
      To: sip:[service]@[remote_ip]:[remote_port][peer_tag_param]
      Call-ID: [call_id]
      CSeq: [cseq] ACK
      Contact: sip:[service]@[local_ip]:[local_port]
      Content-Length: 0

    ]]>
  </send>

  <!-- Send some audio to avoid rtptimeout timers kicking in. -->
  <nop>
    <action>
      <exec rtp_stream="beep_1sec_50x160b.alaw,-1,8"/>
    </action>
  </nop>

  <recv request="BYE"/>

  <send>
    <![CDATA[

      SIP/2.0 200 OK
      [last_Via:]
      [last_Record-Route:]
      [last_From:]
      [last_To:]
      [last_Call-ID:]
      [last_CSeq:]
      Content-Length: 0

    ]]>
  </send>

  <timewait milliseconds="1000"/><!-- retransmit 200's for a while -->

</scenario>
