<?xml version="1.0" encoding="ISO-8859-1" ?>
<!DOCTYPE scenario SYSTEM "sipp.dtd">
<!-- Two failing actions, whose warnings name their variables. -->
<scenario name="action warnings">
  <nop>
    <action>
      <assign assign_to="total" value="10"/>
      <assign assign_to="count" value="0"/>
      <divide assign_to="total" variable="count"/>
      <assignstr assign_to="text" value="not a number"/>
      <todouble assign_to="number" variable="text"/>
      <log message="[$total] [$count] [$number] [$text]"/>
    </action>
  </nop>
  <send>
    <![CDATA[
      OPTIONS sip:[service]@[remote_ip]:[remote_port] SIP/2.0
      Via: SIP/2.0/[transport] [local_ip]:[local_port];branch=[branch]
      From: sipp <sip:sipp@[local_ip]:[local_port]>;tag=[call_number]
      To: <sip:[service]@[remote_ip]:[remote_port]>
      Call-ID: [call_id]
      CSeq: 1 OPTIONS
      Content-Length: 0
    ]]>
  </send>
</scenario>
