<?xml version="1.0" encoding="ISO-8859-1" ?>
<!DOCTYPE scenario SYSTEM "sipp.dtd">
<scenario name="variables screen">
  <send>
    <![CDATA[
      OPTIONS sip:[service]@[remote_ip]:[remote_port] SIP/2.0
      Via: SIP/2.0/[transport] [local_ip]:[local_port];branch=[branch]
      From: <sip:sipp@[local_ip]:[local_port]>;tag=[call_number]
      To: <sip:[service]@[remote_ip]:[remote_port]>
      Call-ID: [call_id]
      CSeq: 1 OPTIONS
      Content-Length: 0
    ]]>
  </send>
  <nop>
    <action>
      <assign assign_to="n" value="3"/>
      <subtract assign_to="n" value="1"/>
      <test assign_to="two" variable="n" compare="equal" value="2"/>
    </action>
  </nop>
  <pause milliseconds="2000"/>
  <nop condexec="two"/>
</scenario>
